{
  "schemaVersion": 1,
  "policyVersion": "ubdr/v1",
  "candidateRelease": "v0.2.0-rc.1",
  "releases": [
    {
      "id": "v0.1.0",
      "version": "0.1.0",
      "sourceRevision": "5bf4aded574df459e80d81b77d1989ecd4fa7de0",
      "distribution": "authentication-required",
      "artifacts": [
        {
          "platform": "linux/amd64",
          "image": "ghcr.io/yacobolo/libredash@sha256:677caaf256cb3a0d61efd47b289debbd91984976a5a5c4b372196a5d79ce7153"
        }
      ],
      "legacyMarkers": [
        "ducklake/catalog.sqlite",
        "libredash-backup.json",
        "libredash.db"
      ],
      "legacyBackupVersions": [],
      "defaults": {
        "freshInstall": {
          "allowed": true,
          "reasonCode": "transition.allowed.fresh_install",
          "remediation": "",
          "requirements": []
        },
        "upgrade": {
          "allowed": false,
          "reasonCode": "transition.denied.fresh_install_only",
          "remediation": "preserve the v0.1.0 state and provision a fresh LeapView instance",
          "requirements": []
        },
        "rollback": {
          "allowed": false,
          "reasonCode": "transition.denied.fresh_install_only",
          "remediation": "do not run v0.1.0 against LeapView state; restore v0.1.0 only in its preserved installation",
          "requirements": []
        }
      }
    },
    {
      "id": "v0.2.0-rc.1",
      "version": "0.2.0-rc.1",
      "sourceRevision": "dfb3086d59284c6597180e99a7d07f41e36a7f7e",
      "distribution": "public",
      "artifacts": [
        {
          "platform": "linux/amd64",
          "image": "ghcr.io/yacobolo/leapview@sha256:8b32fc291c86005c69c2ca1fa673dcaa4cb84d39cfc951e065a2775b122f81d9"
        },
        {
          "platform": "linux/arm64",
          "image": "ghcr.io/yacobolo/leapview@sha256:8b32fc291c86005c69c2ca1fa673dcaa4cb84d39cfc951e065a2775b122f81d9"
        }
      ],
      "legacyMarkers": [],
      "legacyBackupVersions": [],
      "defaults": {
        "freshInstall": {
          "allowed": true,
          "reasonCode": "transition.allowed.fresh_install",
          "remediation": "",
          "requirements": []
        },
        "upgrade": {
          "allowed": false,
          "reasonCode": "transition.denied.no_explicit_rule",
          "remediation": "use an explicitly supported release transition",
          "requirements": []
        },
        "rollback": {
          "allowed": false,
          "reasonCode": "transition.denied.no_explicit_rule",
          "remediation": "use an explicitly supported release transition",
          "requirements": []
        }
      }
    }
  ],
  "transitions": []
}
